course,list,name,offered_w,offered_s,offered_f,easiness_rating,easiness_count,usefulness_rating,usefulness_count,interest_rating,interest_count,description
MSCI 261,CSE_B,Engineering Economics: Financial Management for Engineers,True,False,True,0.8,115,0.35714285714285715,112,0.3046875,128,"Introductory Finance: time value of money, cash flow analysis. Investment evaluation methods: present worth, annual worth and internal rate of return. Depreciation models and asset replacement analysis. The impact of inflation, taxation, uncertainty and risk on investment decisions. [Offered: F,W,S]"
SYDE 262,CSE_B,Engineering Economics of Design,False,False,False,0.8888888888888888,18,0.4444444444444444,18,0.42105263157894735,19,"This course examines a variety of economic factors in Engineering and how they impact design. Topics include business plans, price and output decisions, choosing among alternative inputs, production processes, evaluating alternative investments, equipment service life and depreciation, new products. [Offered: F]"
ANTH 100,CSE_C,Introduction to Anthropology,False,False,False,0.8571428571428571,7,0.8571428571428571,7,1.0,8,Anthropology aims at understanding what it is to be human and to examine how humanity is manifested in the diversity of cultures and societies across time and space. This course gives the student an overview of the breadth of anthropology and orients them toward thinking anthropologically in our shared worlds.
ANTH 201,CSE_C,Archaeological Anthropology,False,False,False,1.0,6,0.6666666666666666,6,0.8333333333333334,6,"An introduction to the working assumptions, analytic approaches, and integrative and descriptive methods of archaeological anthropology."
ANTH 202,CSE_C,Social and Cultural Anthropology,False,False,False,0.6,5,0.6,5,0.8,5,"This course introduces students to fundamental principles of social and cultural anthropology through the reading of ethnographies and supplementary materials as well as the study of films. It examines how anthropologists have used ethnographic approaches to explore the challenges of colonialism, nationalism, genocide, and globalization."
ANTH 221,CSE_C,Anthropology of Language,False,False,False,0.0,0,0.0,0,0.0,0,"This course introduces students to the study of language and culture. Topics covered include language socialization, narrative, the politics of multilingualism, and hate speech."
ANTH 233,CSE_C,Inuit and Eskimo Cultures,False,False,False,0.0,0,0.0,0,0.0,0,"An examination of Inuit and Eskimo cultures of Alaska, Canada and Greenland from their prehistoric origins to the present. Administrative systems imposed upon the Inuit and Eskimo will be analysed and compared, as will the contemporary problems these communities face."
ANTH 241,CSE_C,Anthropology of Food,False,False,False,0.0,0,0.0,0,0.0,0,"The course addresses the topic of food from an anthropological perspective. It examines how the acquisition of food has shaped human biology and forms of social organization. Topics examined include the relationship of food to colonialism, political economy, ritual, and taboo."
ANTH 272,CSE_C,Issues in Contemporary Native Communities in Canada,False,False,False,1.0,2,1.0,2,1.0,2,"An examination of First Nations and Mtis cultures and cultural development from the perspective of local native communities. The course will feature lectures, discussions, and occasional guest speakers representative of the wider native community."
ANTH 290,CSE_C,Visual Anthropology,False,False,False,1.0,1,1.0,1,1.0,1,"This course examines relations between culture and vision, the history of photography in anthropological research, and ethnographic film and its ethical implications. Topics include the roles of museums and representation, indigenous media, advocacy, and activism."
CLAS 100,CSE_C,An Introduction to Classical Studies,False,False,False,1.0,12,0.375,8,0.9090909090909091,11,"An introduction to Greek and Roman civilization, focusing on six key aspects of the discipline of classical studies: history, literature, philosophy, myth and religion, art and architecture, and classical archaeology."
CLAS 104,CSE_C,Classical Mythology,False,False,False,0.9393939393939394,99,0.26136363636363635,88,0.8773584905660378,106,"A study of Greco-Roman mythology and legend, with special emphasis on the Olympian gods and the figure of the hero. Topics may include myths of creation, the rise of the gods, divine myths, the tales surrounding the cities of Troy, Mycenae and Thebes and the heroes Herakles, Perseus and Theseus."
CLAS 105,CSE_C,Introduction to Medieval Studies,False,False,False,0.5,6,0.5,6,0.8571428571428571,7,"An introduction to Medieval European civilization focusing on essential aspects of the discipline: history, literature, philosophy, religion, art, architecture and archaeology, law, and science and technology."
CLAS 201,CSE_C,Ancient Greek Society,False,False,False,0.9259259259259259,27,0.3333333333333333,21,0.8709677419354839,31,"A survey of the civilization of Classical Greece, featuring such topics as the individual (male and female), political institutions, art, religion, philosophy, literature, social life and leisure activities."
CLAS 202,CSE_C,Ancient Roman Society,False,False,False,0.8947368421052632,19,0.2777777777777778,18,0.8947368421052632,19,"A survey of the civilization of the Roman Republic and Empire, featuring such topics as the individual (male and female), political institutions, art, religion, philosophy, literature, social life and leisure activities."
CLAS 205,CSE_C,Medieval Society,False,False,False,1.0,2,0.0,2,1.0,2,"A survey of medieval civilization featuring such topics as the individual (male and female), political institutions, art, architecture, religion, philosophy, literature, social life and leisure activities."
CLAS 210,CSE_C,History of Ancient Law,False,False,False,0.0,0,0.0,0,0.0,0,"An historical introduction to law in the Ancient world. Babylonian, Assyrian, Hittite, and Roman law, legal practices, and concepts will be examined."
CLAS 221,CSE_C,Archaeological Anthropology,False,False,False,0.0,0,0.0,0,0.0,0,"An introduction to the working assumptions, analytic approaches, and integrative and descriptive methods of archaeological anthropology."
CLAS 232,CSE_C,Survey of Roman Literature,False,False,False,1.0,1,0.0,0,1.0,1,"A survey, through English translation, of Latin literature from the earliest times to the medieval period. Material studied may include the genres of epic, tragedy, comedy, history, poetry and philosophy through the works of Vergil, Catullus, Petronius, Livy, and Augustine."
CLAS 242,CSE_C,Survey of Roman Art and Architecture,False,False,False,0.0,1,0.0,0,0.0,0,"A survey of Roman art and architecture from the earliest times to the age of Constantine the Great. Material studied may include the art of the Etruscans, the evolution of Roman portraiture, innovations in architectural materials and forms, the use of art and architecture by the Emperors and the change to Late Antique art."
CLAS 251,CSE_C,Greek History,False,False,False,0.5,2,1.0,1,1.0,2,"A survey of ancient Greek history, from the Bronze Age to Alexander the Great, emphasizing particularly its political and military aspects."
CLAS 252,CSE_C,Roman History,False,False,False,1.0,1,0.0,0,1.0,1,"A survey of ancient Roman history, from the Republic to the Empire, emphasizing particularly its political and military aspects."
CLAS 261,CSE_C,Great Works: Ancient and Medieval,False,False,False,1.0,1,0.0,1,0.0,1,A historical survey of ancient and medieval philosophy in the Western tradition.
CLAS 321,CSE_C,Archaeology of Complex Cultures,False,False,False,0.0,0,0.0,0,0.0,0,Cultural development from the agricultural revolution to the rise of literacy. Special attention to the development of agriculture as a means of subsistence and to the rise of early civilization. Areas and periods of emphasis will vary from year to year.
CLAS 341,CSE_C,Advanced Studies in Greek Art and Architecture,False,False,False,0.0,0,0.0,0,0.0,0,"An advanced survey of the art and architecture from a selected time period of Greek history. Material studied may include the art and architecture of the Aegean Bronze Age, and the Archaic, Classical and Hellenistic periods. Archaeological, historical and cultural issues specific to each time period will be discussed through the important media of the day."
CLAS 352,CSE_C,Advanced Studies in Roman History,False,False,False,1.0,1,0.0,0,1.0,1,"An advanced study of aspects of Roman history, through the examination of a specific time period, event(s) or theme(s). Topics studied may include the Punic Wars, the end of the Republic, the Julio-Claudian Dynasty, history of the High Empire, later Roman history and Roman social history."
CLAS 361,CSE_C,History of Ancient Philosophy,False,False,False,0.0,0,0.0,0,0.0,0,"In this course, students will examine one or more important figures, periods, or issues in ancient philosophy. Plato and Aristotle are among the philosophers who may be covered."
CLAS 461,CSE_C,Studies in Ancient Philosophy,False,False,False,0.0,0,0.0,0,0.0,0,"Special topics in ancient philosophy, as announced by the department."
CLAS 486,CSE_C,Senior Seminar,False,False,False,1.0,1,0.0,0,0.0,0,Each Fall and Winter term a senior seminar on some aspect of Greek or Roman civilization will be offered.
CLAS 486,CSE_C,Senior Seminar,False,False,False,1.0,1,0.0,0,0.0,0,Each Fall and Winter term a senior seminar on some aspect of Greek or Roman civilization will be offered.
GRK 101,CSE_C,Introductory Ancient Greek 1,False,False,False,0.5,2,1.0,2,1.0,2,"A course designed for students beginning the study of ancient Greek or who have not yet reached the level expected in GRK 201/202. The teaching approach emphasizes exposure to simple texts as soon as possible, but students desiring minimal competence in reading should go on to do GRK 102."
GRK 102,CSE_C,Introductory Ancient Greek 2,False,False,False,1.0,1,0.0,0,1.0,1,"Continuation of GRK 101. Most of the rules of Greek grammar will be covered by the end of the year, and students should have a minimal competence in reading prose texts; but for the remaining grammar and further practice students should go on to do GRK 201."
GRK 201,CSE_C,Intermediate Greek,False,False,False,1.0,1,0.0,0,1.0,1,The course will complete the study of Greek grammar and move on to unadapted readings in Greek authors.
GRK 202,CSE_C,Selections from Greek Authors,False,False,False,0.0,0,0.0,0,0.0,0,A course designed to follow GRK 201 including both literature and grammar review. Authors normally read are Plato and Homer.
GRK 331,CSE_C,Advanced Studies in Greek: Prose,False,False,False,0.0,0,0.0,0,0.0,0,"A selection of material from one author or several authors within the field of Greek prose. Topics and selections may include oratory, history, philosophy, Demosthenes, Herodotos, Xenophon, Plato and Aristotle."
GRK 490,CSE_C,Senior Studies in Greek: Selected Topics,False,False,False,0.0,0,0.0,0,0.0,0,"A selection of material from one author or several authors or an investigation of selected themes, topics, genres at the senior level. Topics or authors may include epic, tragedy, history, philosophy, Hellenistic poetry, Hesiod, Euripides, Menander, Thucydides, Apollonius, Callimachus, and Nonnos."
LAT 101,CSE_C,Introductory Latin 1,False,False,False,0.7857142857142857,14,0.75,12,0.8,15,"A course designed for students beginning the study of Latin or who have not yet reached the level expected in LAT 201/202. Although the teaching approach emphasizes exposure to simple texts as soon as possible, students desiring minimal competence in reading should go on to do LAT 102."
LAT 102,CSE_C,Introductory Latin 2,False,False,False,1.0,3,1.0,2,1.0,5,"Continuation of LAT 101. Most of the rules of Latin grammar will be covered by the end of the year, and students should have a minimal competence in reading prose texts; but for the remaining grammar and further practice students should go on to do LAT 201."
LAT 201,CSE_C,Intermediate Latin,False,False,False,0.5,2,0.5,2,1.0,3,"The course will complete the study of Latin grammar and move on to unadapted readings in Latin authors, particularly Caesar."
LAT 202,CSE_C,Selections from Latin Authors,False,False,False,1.0,1,1.0,1,1.0,1,"A course designed to follow LAT 201, including both literature and grammar review. Authors normally read are Vergil and Ovid."
LAT 331,CSE_C,Advanced Readings in Latin: Prose,False,False,False,0.0,0,0.0,0,0.0,0,"A selection of material from one author or several authors within the field of Latin prose. Topics and selections may include oratory and rhetoric, history, philosophy, Cicero, Quintilian, Caesar, Livy, and Apuleius."
LAT 490,CSE_C,Senior Studies in Latin: Selected Topics,False,False,False,0.0,0,0.0,0,0.0,0,"A selection of material from one author or several authors or an investigation of selected themes, topics or genres at the senior level. Topics and authors may include philosophy, letter writing, history, elegy, satire, Seneca, Pliny the Younger, Tacitus, Propertius, Petronius and Juvenal."
DRAMA 100,CSE_C,Introduction to Theatre,False,False,False,0.5,4,1.0,4,1.0,4,This course introduces students to the processes of text-based theatre creation and production. Students produce an existing play text by developing and implementing an original conceptual approach. Prior experience in theatre-making is not required.
DRAMA 200,CSE_C,Theatre and Performance in Context,False,False,False,0.0,0,0.0,0,0.0,0,"Students experience, analyze, and interpret a range of works of theatre and performance. Close attention is paid to the original circumstances in which these works were produced, the ways in which they have reflected and influenced the communities that produced them, and their relevance to current performance practice and research."
EASIA 201R,CSE_C,Introduction to East Asia,False,False,False,0.7777777777777778,18,0.6111111111111112,18,0.6842105263157895,19,"An introductory survey of the history and cultures of East Asia with particular reference to China, Japan, and Korea."
ECON 100,CSE_C,Principles of Economics,False,False,False,0.0,4,0.75,4,0.25,4,"This course provides an introduction to the basic concepts and tools of micro and macro economic analysis of individuals, businesses, and government in the global world. Topics may include consumers, producers, market structures, national income accounting, unemployment, inflation."
ECON 101,CSE_C,Introduction to Microeconomics,False,False,False,0.7559912854030502,459,0.6484560570071259,421,0.49901768172888017,509,"This course provides an introduction to microeconomic analysis relevant for understanding the Canadian economy. The behaviour of individual consumers and producers, the determination of market prices for commodities and resources, and the role of government policy in the functioning of the market system are the main topics covered."
ECON 102,CSE_C,Introduction to Macroeconomics,False,False,False,0.7625418060200669,299,0.6254681647940075,267,0.5591715976331361,338,"This course introduces students to the measurement and behaviour of key macroeconomic variables both in Canada and around the world. Topics include national accounts, inflation, interest rates, wages, international balance of payments, business cycles, growth, employment, unemployment, poverty, and inequality."
ECON 201,CSE_C,Microeconomic Theory for Business and Policy,False,False,False,0.6753246753246753,77,0.6,60,0.6144578313253012,83,This course offers an introduction to the theory of market based economies. Topics include consumer choice; production; price and output under perfect and imperfect competition; price discrimination and two part pricing; vertical and horizontal firm boundaries and integration; and market structure.
ECON 206,CSE_C,Money and Banking 1,False,False,False,0.0,0,0.0,0,0.0,0,"This course offers an overview of the functioning of the financial system both in Canada and abroad. It includes discussions of money and inflation, financial assets, and financial institutions and intermediaries."
ECON 207,CSE_C,Economic Growth and Development 1,False,False,False,0.0,0,0.0,0,0.0,0,"This course offers an overview of the enormous differences in living standards across countries and over time, and it considers how these can be traced to differences in economic productivity, investment, population, natural resources, government, inequality, and culture."
ECON 212,CSE_C,Introduction to Game Theory,False,False,False,0.0,0,0.0,0,0.0,0,"Game theory analyzes the strategic interaction between agents. It has applications in various fields including economics, law, political science, biology, and computer science. This course introduces the basic tools of game theoretic analysis and examines applications such as auctions, business strategy, and curbing carbon emissions. The course includes an experiential learning component where students play strategic games against each other."
ECON 220,CSE_C,Entrepreneurship Principles and Practices,False,False,False,0.75,28,0.45,20,0.5172413793103449,29,"The role of the entrepreneur, the entrepreneurial firm, and the creative society are examined. Students are exposed to the practices that enable workplace creativity and innovation with exposure to leadership theory and project management."
ECON 231,CSE_C,Introduction to International Economics,False,False,False,0.55,20,0.5,16,0.6666666666666666,24,This course explores international trade in goods and services as well as the international exchange of financial assets. Economic theories will be examined which help explain how international transactions affect the world's economies. Topics include the theory of comparative advantage and the gains from trade; tariff theory; concepts and measurement of balance of payments; exchange rate systems; and the international monetary system.
ECON 254,CSE_C,Economics of Sport,False,False,False,1.0,5,0.8,5,1.0,5,"The course will develop fundamental economic concepts in the context of the sports industry. The course begins with an investigation of some of the primary aspects of the way that the sports industry is organized. The course then considers labour economics in the context of sport. Finally, the course examines the issues that arise with the introduction of various levels of government and/or regulatory bodies in the sports industry, looking at competition between cities for sports teams."
ECON 255,CSE_C,Introduction to the Economics of Natural Resources,False,False,False,0.0,0,0.0,0,0.0,0,"This course uses the theory and tools of economics to explore key problems in natural resource use and management. The meaning and implications of natural resource scarcity are explored, as well as how the insights of economics can be used to guide policies to promote a more sustainable path for our future. The course examines issues of economic efficiency and equity in specific resource sectors such as energy resources, fisheries, forestry, and water."
ECON 256,CSE_C,Introduction to Health Economics,False,False,False,0.0,0,0.0,0,0.0,0,"Why are some people healthy and others not? Why is health different from other goods and services? How do the many stakeholders interact in health care markets? Why do countries have different health care systems? This course introduces students to how the theories and tools of economics can be used when examining health, health care, and health care policies. Concepts such as supply and demand, uncertainty, and utility will be introduced in the context of health and health care markets. While international institutions may be discussed, the course will emphasize Canadian health care markets."
ECON 261,CSE_C,Philosophy of Economics,False,False,False,0.0,0,0.0,0,0.0,0,"This course considers conceptual, methodological, foundational, and ethical issues in economic theory and practice. Questions include: What can philosophy teach us about economic methodology and justification? Are economic formalizations useful idealizations of human behaviour? Is economics a science? What role do values play in economic reasoning and policy-making?"
ECON 262,CSE_C,History of Economic Thought,False,False,False,0.0,0,0.0,0,0.0,0,"This course studies approaches to economic problems in historical context. Authors examined may include Smith, Malthus, Ricardo, Marx, J.S. Mill, Walras, Marshall, Veblen, Keynes, Hayek, Aumann, Debreu, and Stiglitz."
ECON 290,CSE_C,Models of Choice in Competitive Markets,False,False,False,0.0,0,0.0,0,0.0,0,"Choice lies at the heart of all economic models. This course focuses on choice by consumers and firms. It explains the notion and use of utility functions and budgets, and shows how their interaction allows economists to make predictions about behaviour. The constrained maximization techniques from ECON 211 are used extensively, and extended to situations covering uncertainty (risk) and time. Profit maximization by firms is explored."
ECON 301,CSE_C,Microeconomic Theory 2,False,False,False,0.45454545454545453,22,0.7222222222222222,18,0.6538461538461539,26,Pricing and employment of inputs; general equilibrium theory; theory of modern welfare economics with some applications; intertemporal choice.
ECON 302,CSE_C,Macroeconomic Theory 2,False,False,False,0.3333333333333333,21,0.9,10,0.6,25,"An extension of the tools developed in Macroeconomic Theory 1 to analyse topics such as unemployment and inflation, government spending, finance, consumption, investment, growth, and the open economy."
ECON 306,CSE_C,Macroeconomics,False,False,False,0.0,0,0.0,0,0.0,0,"This course introduces students to the analysis of inter-temporal trade-offs in macroeconomics and macroeconomic policy. Its main objective is to show how economists use economic theory to analyze the role of incentives and general equilibrium considerations in the macro-economy. Applications include national savings and investment, business cycles, and monetary and fiscal policy."
ECON 322,CSE_C,Econometric Analysis 1,False,False,False,0.0,0,0.0,0,0.0,0,"This course covers the core topics needed to estimate linear models using ordinary least squares and to interpret estimates for cross-sectional data. Students will learn to interpret the coefficients of linear models for continuous and discrete regressors, to conduct reliable inference for different specifications of the error term, and to determine which model is the most suitable among the class of linear models. It concludes with an introduction to the method of instrumental variables. Students will be introduced to a statistical software package and will be required to complete regular computer-based assignments throughout the course that either: (i) simulate the statistical distribution of the least squares estimator under an assumed model; or (ii) estimate the parameters of an assumed model using a sample of data from the real world."
ECON 323,CSE_C,Econometric Analysis 2,False,False,False,0.0,0,0.0,0,0.0,0,"This course covers the most important methods used in applied economics research beyond the least-squares estimator. It starts by exploring solutions to the endogeneity problem in detail, emphasizing proper ways of conducting causal inference. It extends the methods covered in ECON 322 to the case in which the data are observed over time. Students will learn how to estimate and interpret dynamic models and how these models affect our ability to do inference. The course also covers methods for data in which the response variable is either qualitative, with or without multiple levels, or count data. For that purpose, it introduces students to maximum likelihood estimation, and the estimation of models by probit, logit, and Poisson regressions. Assignments have the same data-based focus as in ECON 322."
ECON 332,CSE_C,International Finance,False,False,False,0.5,2,1.0,2,0.5,2,"An analysis of the main issues in international finance. Topics include international borrowing and lending, intertemporal gains from trade, current account and balance of trade movements, the determination of exchange rates and foreign exchange markets."
ECON 341,CSE_C,Public Economics: Expenditure,False,False,False,1.0,1,1.0,1,0.0,1,"The course focuses on the rationale for government intervention in a market economy. The course begins with a consideration of market successes through the analysis of the first and second theorems of welfare economics. The course then considers market failures through an analysis of distributional issues, public goods, externalities, non-competitive market structures, and asymmetric information. Time permitting, some issues in the public economics of taxation may be covered."
ECON 342,CSE_C,Public Economics: Taxation,False,False,False,0.0,0,0.0,0,0.0,0,"The course focuses on the public economics of taxation. Normative topics include the efficiency and distributional aspects of taxation and positive topics include the incentive effects of taxation and tax incidence. Time permitting, some issues in public expenditure theory may be covered."
ECON 344,CSE_C,Marketing 1: Principles of Marketing and Consumer Economics,False,False,False,0.8205128205128205,39,0.5862068965517241,29,0.6511627906976745,43,"Economic principles for marketing, exchange theory and consumer analysis, product or service introductions, public and private policies for advertising, differentiation, and quality assurance."
ECON 345,CSE_C,Marketing 2,False,False,False,0.0,0,0.0,0,0.0,0,"Because firms exist to satisfy customer needs, a solid understanding of the consumer is needed for any successful marketing management. The course also considers how products, services, and consumption can have far-reaching social impacts."
