course,list,name,offered_w,offered_s,offered_f,easiness_rating,easiness_count,usefulness_rating,usefulness_count,interest_rating,interest_count,description
HIST 103,CSE_C,Canadian History Through Biography,False,False,False,1.0,1,0.5,2,1.0,3,"An examination through lectures and film of the lives of Canadian men and women who have played formative roles in developing the Canadian nation. Examples will be drawn from such areas as politics, religion, business and labour, social reform, arts and entertainment, and sports."
HIST 105,CSE_C,Rock 'n' Roll and US History,False,False,False,1.0,11,0.6666666666666666,9,1.0,13,"This course explores the politics, culture, media, race relations, and gender relations of the United States after 1945 through the lens of rock and roll."
HIST 106,CSE_C,Canada at War,False,False,False,1.0,4,0.5,4,0.6,5,"This course introduces students to the ways in which historians have examined Canada's military experience. Beginning with the Boer War, and continuing through the two World Wars and the post-war era, students examine the political, social, as well as military effects of war on Canada."
HIST 109,CSE_C,Ten Days That Shook the World,False,False,False,0.5,2,0.5,2,0.5,2,"Focusing on ten different days that forever transformed the world's history, this course introduces first-year students to moments of dramatic change in diverse time periods and places. Topics may include the Fall of Ancient and Modern Regimes; the Age of Discovery; Religious Cataclysm; Revolutionary Wars; Technological, Intellectual, and Scientific Inventions. Students are introduced to the differing methods that historians use to understand the past."
HIST 110,CSE_C,A History of the Western World I,False,False,False,0.7692307692307693,13,0.6,10,0.7894736842105263,19,"This course will survey the emergence and development of the Western world, from prehistory to 1715. Complementing the chronological and narrative overview of western culture and civilization will be thematic surveys of developments in the arts and humanities, science, and socio-political structures."
HIST 111,CSE_C,A History of the Western World II,False,False,False,0.0,0,0.0,0,1.0,1,"This course will survey the emergence and development of the Western world from the 17th century to the present. Complementing the chronological and narrative overview of western culture and civilization will be thematic surveys of developments in the arts and humanities, science, and socio-political structures."
HIST 113,CSE_C,Canadian Business History: Innovators and Entrepreneurs,False,False,False,0.7857142857142857,14,0.14285714285714285,14,0.4375,16,"This course examines the role of individuals in the growth of business in Canada. While there will be general examination of Canadian economic development, the principal focus will fall upon leading Canadian business persons and their interests and innovations. The relationship to the state of business, the place of education, and the impact of immigration are other topics that the course will consider."
HIST 115,CSE_C,Crusading in the Middle Ages,False,False,False,0.0,0,1.0,1,1.0,1,"This course examines the historical events and cultural assumptions that led to the European phenomenon of crusading, or holy war, between 1095 and 1453."
HIST 203,CSE_C,Methods of Applied History,False,False,False,0.0,0,0.0,0,0.0,0,"This course exposes students to several different forms of applied history, which may include historic mapping, digitization, genealogy, public policy research, corporate history, legal research, tourism, the commemoration industry, historical fiction and creative non-fiction, heritage issues, and the making of historical documentaries. The specific mix of topics addressed in any particular year will vary, depending on the instructor."
HIST 205,CSE_C,History of Western Sport,False,False,False,0.875,8,0.375,8,0.375,8,"This course considers the historical impact of Western sport. It traces the history from individual play through amateurism to professionalism, big business, and media. It examines sport's social role within local, national, and international communities, and its relationship to class, gender, leisure, race, and politics."
HIST 220,CSE_C,The Vietnam War,False,False,False,0.6666666666666666,3,0.6666666666666666,3,1.0,3,"The Vietnam War, the longest war in U.S. history, was fought on two fronts, by American G.I.s abroad and anti-war protesters at home. Those two subjects, as well as a history of the war from Vietnamese perspectives, are the focus of this course."
HIST 230,CSE_C,Introduction to the Modern Middle East,False,False,False,0.0,1,1.0,1,1.0,1,"This course examines the modern political history of the Middle East, with an emphasis on international affairs. It examines the colonization of the Middle East, the rise of national self-determination and nation-states, enduring Arab-Israeli conflicts, the Cold War, and the impact of US foreign policy in shaping the modern Middle East."
HIST 247,CSE_C,Mennonite History: A Survey,False,False,False,1.0,1,1.0,1,1.0,1,"This course covers Mennonite origins, teachings, migrations, settlement patterns, divisions, leaders, institutions, and religious and social practices, indeed all facets of Mennonite history in various national settings."
HIST 258,CSE_C,The United States: From World Power to the War on Terror,False,False,False,0.7142857142857143,7,0.75,4,1.0,6,"This course begins in the aftermath of the Civil War and ends at the present day. Topics may include major social movements, the place of the United States in world politics, immigration and imperialism, and the economy."
HIST 291,CSE_C,Special Topics in History,False,False,False,0.0,1,1.0,2,1.0,2,One or more term courses will be offered from time to time as announced by the History Department. Topics will be dependent upon special research and/or instructional interests of faculty.
HIST 302,CSE_C,Applied History Project,False,False,False,0.0,0,0.0,0,0.0,0,"This course provides the opportunity to design, research, and produce a history project in a multimedia format. Students incorporate archival, visual culture, and oral history research in their projects and examine the politics, ethics, and practice of historical research and its presentation to wide audiences."
HIST 374,CSE_C,Canada's Social History,False,False,False,0.0,0,0.0,0,0.0,0,"A topical consideration of key themes, approaches, and chronologies in the history of society in Canada."
HRM 200,CSE_C,Basic Human Resources Management,False,False,True,0.8714285714285714,70,0.576271186440678,59,0.5675675675675675,74,"Examines the major areas of human resources administration including recruiting, salary administration, labour relations, benefits administration, employee relations, labour law, and organizational behaviour. Reviews the role of human resources administration in organizations and the manner in which human resources executives contribute to the well-being of a total enterprise. [Offered F, W, S]"
HRM 200,CSE_C,Basic Human Resources Management,False,False,True,0.8714285714285714,70,0.576271186440678,59,0.5675675675675675,74,"Examines the major areas of human resources administration including recruiting, salary administration, labour relations, benefits administration, employee relations, labour law, and organizational behaviour. Reviews the role of human resources administration in organizations and the manner in which human resources executives contribute to the well-being of a total enterprise. [Offered F, W, S]"
HRM 301,CSE_C,Strategic Human Resources Management,False,False,False,0.75,4,0.5,4,0.75,4,"An examination of the issues and challenges confronted by human resource professionals when planning and forecasting the staffing needs of an organization. Topics covered may include aligning human resource practices with organizational objectives, succession planning, redesign of work systems, and the impact of human resource practices on organizational outcomes."
HRM 303,CSE_C,Compensation,False,False,False,1.0,3,1.0,3,1.0,3,"This course deals with the process, issues, and techniques involved in developing and administering a compensation system. Students will gain knowledge from both the theoretical and applied aspects of the compensation function within organizations, including understanding the importance of compensation, assessing and diagnosing compensation issues, and developing appropriate solutions."
HRM 305,CSE_C,Health and Safety,False,False,False,1.0,1,1.0,1,0.5,2,"This course introduces the broad and ever-changing field of occupational health and safety. Understanding the multiple dimensions of the various issues - technical, legislative, political, personal - is essential to HR professionals overseeing an organization's health and safety function, and to those dealing with consultants or joint health and safety committees."
HRM 307,CSE_C,Labour Relations,False,False,False,1.0,1,1.0,1,1.0,1,"This course draws upon the disciplines of law and history to assess various aspects of the current industrial relations climate. Topics may include employment standards and labour relations legislation, collective bargaining, dispute resolution procedures, contract administration, industrial democracy, and the structure and growth of the Canadian labour movement."
HRM 400,CSE_C,Honours Seminar in Human Resources Management - Special Topics,False,False,False,0.0,0,0.0,0,0.0,0,"Topics reflect current issues in human resources management. Consult the departmental listings for the upcoming topics. Activities may include oral presentations, class discussions, individual and/or group projects, and written assignments."
HUMSC 101,CSE_C,Great Dialogues: Reflection and Action,False,False,False,1.0,5,0.6666666666666666,3,0.8,5,"What is the relationship between thinking and action? Do they pull us in different directions? Can they be integrated? This course investigates how our own dialogue with core texts, from antiquity (e.g., Homer, Plato, Christian Scriptures) to the present (e.g., Joyce, Arendt), offers ways of understanding the dilemmas and issues raised by these texts and present in our culture."
HUMSC 102,CSE_C,Great Dialogues: Politics and Morality,False,False,False,1.0,4,1.0,3,1.0,3,"What is the relationship between politics and morality? Are they opposites? Can they be integrated? This course investigates the way our own dialogue with core texts, from the Renaissance to the present (authors may include Machiavelli, Shakespeare, Wollstonecraft, Marx, Conrad, and Arendt), offers ways of thinking through the dilemmas and issues raised by these texts and present in our culture."
INTST 101,CSE_C,Introduction to International Studies,False,False,False,0.9078947368421053,76,0.5942028985507246,69,0.759493670886076,79,"Conflict and cooperation have been the central problems of international politics throughout history, and remain so today. This course introduces aspects of these problems and attempted solutions. Specific topics and approaches vary by instructor."
KIN 352,CSE_C,Sociology of Aging,False,False,False,0.0,0,0.0,0,0.0,0,An introduction to individual and population aging. Topics discussed include: aging from a historical and comparative perspective; aging in subcultures; aging and the social structure; aging and social processes; aging and the environment; work and retirement; and aging and leisure patterns.
KIN 354,CSE_C,Psychology of Physical Activity,False,False,False,0.7222222222222222,18,0.17647058823529413,17,0.3157894736842105,19,"A comprehensive survey of psychological factors implicated in physical activity performance. Topics include social cognitive theories of physical activity behaviour, perception and sport performance, exercise training and brain function, exercise as a treatment modality for psychiatric conditions, and urban design as a means of physical activity promotion."
LS 101,CSE_C,Introduction to Legal Studies,False,False,False,0.5471698113207547,53,0.8043478260869565,46,0.576271186440678,59,"An introduction to the study of law, its structure, and legal institutions from a cross-cultural and historical perspective. This interdisciplinary course examines the origins of legal systems and their impact on society. Included is an analysis of the diverse historical, political, economic, and cultural conditions under which law arises and functions within society."
LS 202,CSE_C,Criminal Law,False,False,False,0.5,6,1.0,7,0.8571428571428571,7,A case-study approach to the study of criminal law in Canada with a focus on basic concepts and core principles relating to legal judgements along with comparative examination between civil and criminal law and attention to legal theory.
MSCI 211,CSE_C,Organizational Behaviour,False,False,True,0.8314606741573034,89,0.3333333333333333,84,0.5520833333333334,96,"Introduction to the concepts of learning, person perception, attitudes and motivation in an organization. Consideration of communication, roles, norms and decision making within a group. Discussion of power, control, leadership and management in light of the above concepts. [Offered: F, W, S]"
MSCI 263,CSE_C,Managerial Economics,False,False,False,0.3333333333333333,6,1.0,6,0.6666666666666666,9,"This course introduces students to key concepts in microeconomics, with an emphasis on applications to managerial decision-making. Topics include: basic analysis of supply and demand, demand functions and the theory of consumer behaviour, production and costs, market equilibrium, competition between industry participants, and pricing strategies of firms under different market structures. [Offered: S]"
MSCI 311,CSE_C,Organizational Design and Technology,False,False,True,0.88,25,0.5217391304347826,23,0.5,30,"The focus of this course is on the procedures and variables involved in the design and redesign of organizations. Issues such as departmentation, differentiation, integration, internal politics, innovation, authority and control are discussed in the context of the underlying technology of the organization. Emphasis will be placed on how one designs both the technical and the organizational systems to ensure their compatibility, noting the effects that one has on the other. [Offered: F, W]"
MSCI 411,CSE_C,Leadership and Influence,False,False,False,0.0,0,0.0,0,0.0,0,"This course will provide students with an overview of how management, psychology, marketing, and related fields have approached the topics of leadership, influence, and power. The first section of the course will address the antecedents of leadership (e.g., How do specific leaders emerge? What are the qualities of good leaders?). The second section of the course will address the act of leadership (e.g., How do leaders influence their followers? What limitations are inherent to leadership positions?) Specific topics covered include leadership styles, persuasion, social influence, evolutionary perspectives, motivating others, and managing conflict. [Offered: S]"
MUSIC 140,CSE_C,Popular Music and Culture,False,False,False,0.8194444444444444,72,0.5942028985507246,69,0.922077922077922,77,"An examination of the styles, forms and development of 20th-century popular music. The social, commercial and technological aspects of popular music are considered."
MUSIC 245,CSE_C,World Music,False,False,False,0.3333333333333333,3,0.3333333333333333,3,0.6666666666666666,3,"A survey of traditional music outside of North America, including Africa, South America, the Far East, the South Pacific, the mid-East and Europe, with special emphasis on the role of music within the culture."
MUSIC 253,CSE_C,Cathedral and Court: Music to 1600,False,False,False,0.0,1,0.0,1,1.0,1,"A study of major developments in western music during the Middle Ages and Renaissance, including Gregorian chant, mass, secular songs, instrumental music, and other musical genres that flourished under courtly and church patronage from the early Christian church to 1600."
MUSIC 256,CSE_C,Music Since 1900,False,False,False,1.0,1,0.0,0,1.0,1,"A study of music of the 20th and early 21st centuries in cultural, political, and artistic contexts. Topics include modern and contemporary composers' challenges to traditional musical ideals in the music of Debussy, Stravinsky, Schoenberg, Cage, and others."
MUSIC 334,CSE_C,Women and Music,False,False,False,0.0,0,0.0,0,0.0,0,"An examination of women's roles in music from a cross-cultural perspective. Topics include women's music as a genre, historical accounts of women's music-making, the effects of gender ideology on women's musical activities, and music behaviour and performance in inter-gender relations."
MUSIC 355,CSE_C,Music and Culture Travel Course,False,False,False,0.0,0,0.0,0,0.0,0,"A Spring term seminar approximately three weeks long, taught on location including daily lectures, attendance at music performances, and tours to places of cultural importance. Past and possible future locations include Vienna, London, Leipzig, South Africa, Morocco, Bali, and Estonia."
MUSIC 363,CSE_C,The Christian Hymn,False,False,False,0.0,0,0.0,0,0.0,0,"The origins of the Christian hymn and its development up to the present. The course considers the hymn as theological, poetic, musical, cultural, and spiritual expression, and the use of hymns in a variety of worship settings."
PACS 101,CSE_C,Peace is Everybody's Business,False,False,False,1.0,7,0.42857142857142855,7,0.7142857142857143,7,"This course explores ways in which individuals and groups from multiple sectors of society have contributed to peace by engaging conflict constructively and advancing social justice. Attention will be given to the diversity of peacemaking approaches, and to interpersonal and intergroup as well as international applications."
PACS 201,CSE_C,"Roots of Conflict, Violence, and Peace",False,False,False,0.7333333333333333,15,0.5384615384615384,13,0.6,15,"An examination of influential theories about the sources and nature of conflict, violence, and peace. Contributions from the social sciences as well as the humanities will be explored, with attention to connections between interpersonal, intergroup, and international levels of analysis."
PACS 202,CSE_C,Conflict Resolution,False,False,False,0.78125,32,0.8666666666666667,30,0.8484848484848485,33,"An examination of the resolution of conflicts, ranging from interpersonal to broader social and international conflicts. Students are introduced to negotiation, mediation, and nonviolent resistance, and are encouraged to develop their own theoretical understandings that aid in addressing conflict."
PACS 203,CSE_C,A History of Peace Movements,False,False,False,1.0,3,0.0,2,0.5,2,"A survey of individuals and groups that have created popular movements for peace globally and locally throughout history. The scope will be international, with a particular focus on the nineteenth- and twentieth-century movements. The choice of peace movements will allow for a contrast in comparison of ideology, strategy, and impact."
PHIL 100J,CSE_C,Introduction to Philosophy,False,False,False,0.8,15,0.46153846153846156,13,0.5294117647058824,17,This course seeks to introduce students to the nature of philosophy. This is done through the examination of core texts and figures in the history of philosophy as well as in the discussion of perennial philosophical questions.
PHIL 110A,CSE_C,Introduction to Philosophy: Knowledge and Reality,False,False,False,0.72,25,0.5,24,0.8275862068965517,29,"An introduction to central issues in metaphysics and epistemology. Questions to be considered might include: ""Can we know anything?"", ""Does God exist?"", ""Is the mind just a brain?"", ""Do human beings have free will?"""
PHIL 110B,CSE_C,Introduction to Philosophy: Ethics and Values,False,False,False,0.6774193548387096,31,0.4482758620689655,29,0.5428571428571428,35,"This course is an introduction to philosophical thinking about ethics and value, that is, about what is good, right, fair, just, and worthwhile in life. Includes consideration of questions such as ""What is the right thing to do?"" and ""Do human beings have free will?"""
PHIL 118J,CSE_C,The Moral Life,False,False,False,0.0,0,0.0,0,0.0,0,An examination of the importance of virtue in general and of the cardinal virtues in particular for the development of character and the enjoyment of the good life.
PHIL 120J,CSE_C,Philosophy of Life and Death,False,False,False,0.0,0,0.0,0,0.0,0,A study of what some of the great philosophers have said about the meaning of life and death and the transition from life to death. Students are urged to raise questions and help direct discussion.
PHIL 201,CSE_C,Philosophy of Sex and Love,False,False,False,1.0,2,1.0,2,1.0,2,"Classic and contemporary philosophical examination of sex and love. Questions considered might include the following: Do you love because your love-object is worthy, or do you find your love-object worthy because of your love for him/her/it ? Does sex ever involve using persons as mere means to an end? Should it?"
PHIL 202,CSE_C,Gender Issues,False,False,False,1.0,4,0.5,4,0.5,4,"Philosophical analysis of issues relating to sex/gender. Questions considered might include the following: What, if anything, is the difference between sex and gender? How much of a role do facts about biology play in our ideas about sex and gender? How many sexes are there? What ethical issues arise for us in virtue of our gender?"
PHIL 204J,CSE_C,Philosophy and Culture,False,False,False,0.0,0,0.0,0,0.0,0,An analysis of the philosophical assumptions of Western popular culture as reflected in various mass media and in current models of production and consumption.
PHIL 208,CSE_C,Philosophy Through Science Fiction,False,False,False,1.0,2,1.0,1,1.0,2,"Questions regarding such matters as the nature of knowledge, logic and language, mind and brain, space and time, causality, ethics, and politics are explored through classic philosophic texts and science fiction narratives."
PHIL 209,CSE_C,Philosophy in Literature,False,False,False,0.5,2,1.0,2,1.0,2,Philosophical themes will be explored through appropriate literary works.
PHIL 210J,CSE_C,Philosophy of Human Nature,False,False,False,0.0,1,0.0,1,0.0,1,What is a human being? What is the place of humans among other creatures? Are human beings accidents of evolution? What are the major theories of human nature? How are love and sex aspects of human life?
PHIL 215,CSE_C,Professional and Business Ethics,False,False,False,0.7209302325581395,43,0.696969696969697,33,0.8095238095238095,42,"Study of ethical and moral issues that typically arise in professional and business activity. What responsibilities to society at large do people in such business and professional activities as teaching, engineering, planning, architecture, and accounting have? How far should professional autonomy extend?"
PHIL 218J,CSE_C,Ethical Theory,False,False,False,0.0,0,0.0,0,1.0,1,"The search to establish a rational basis for ethics. Consideration will be given to ethical theories which help to shed light on the most fundamental problem of ethics: the existence and the nature of the good, understood as the question of what makes a human life a good life."
PHIL 219J,CSE_C,Practical Ethics,False,False,False,0.0,1,0.0,1,0.0,1,"This course will examine a variety of applied ethical issues. The topics that may be discussed include abortion, euthanasia, pornography, environmentalism, animal rights, poverty, and reproductive technologies."
PHIL 220,CSE_C,Moral Issues,False,False,False,0.6875,16,0.6428571428571429,14,0.7058823529411765,17,"This course surveys several controversial moral topics, and a range of philosophical views on each. Topics may include abortion, cloning, euthanasia and suicide, sexism, prostitution, pornography, torture, and animal rights."
PHIL 221,CSE_C,Ethics,False,False,False,0.5,6,0.2,5,0.7142857142857143,7,"An introduction to moral theories, including ones based on virtue, consequences, and rights and duties, with discussion of historical developments leading to those theories."
PHIL 224,CSE_C,Environmental Ethics,False,False,False,0.47619047619047616,21,0.6666666666666666,18,0.5909090909090909,22,"Philosophical perspectives on such issues as climate change, pollution, use of scarce resources, biodiversity, and our relations with animals and future generations. This course will also consider bioactivism and other approaches to environmental problems."
PHIL 226,CSE_C,Biomedical Ethics,False,False,False,0.6470588235294118,34,0.5151515151515151,33,0.6842105263157895,38,"An examination of ethical issues in the health sciences, such as the patient-doctor relationship, reproductive rights and technologies, genetic testing, allocation of medical resources, and end of life decisions."
PHIL 227,CSE_C,Culture and Ethics,False,False,False,0.0,0,0.0,0,0.0,0,"This course surveys a variety of competing ethical positions that have been, and continue to be, adopted by different cultures around the world. Can two competing ethical viewpoints both be right? If not, then what grounds should we adopt to decide between them, and under what circumstances? How can we negotiate the difficulties that such differences pose for our practical judgment and moral theorizing? Students will engage these questions by reading texts in philosophical ethics and meta-ethics, and by applying what they have learned in case studies of ethical differences among cultures."
PHIL 230J,CSE_C,God and Philosophy,False,False,False,1.0,1,1.0,1,1.0,1,An investigation of several aspects concerning the meaning and existence of God. Is God-talk possible? Can faith and reason be reconciled? Is religious experience a meaningful argument? A wide range of different views will be considered.
